{
  "artifacts": [
    {
      "bytes": 65889,
      "path": "files/benchmark/apex2_simplified_likelihood_report.json",
      "sha256": "7c6ee0a78709a0094a1f3e5935d7aee31c51558dd63f6f904778b7cb1a8ae2b7"
    },
    {
      "bytes": 2834,
      "path": "files/benchmarks/artifacts/simplified_likelihood_export_benchmarks/nextstat-bench/current/export_benchmark_snapshot_report.json",
      "sha256": "befccc06a478722c65432ae3587f60afed035b9f200a1fc443f7693b1cda7fc8"
    },
    {
      "bytes": 833,
      "path": "files/benchmarks/artifacts/simplified_likelihood_export_benchmarks/nextstat-bench/current/snapshot_index.json",
      "sha256": "b31e67ac6b108f90ba728ef89f12ab94d53cb6de4a7416fb0412f2433509d517"
    },
    {
      "bytes": 17260,
      "path": "files/docs/benchmarks/simplified-likelihood-benchmark-snapshot-2026-03-08.md",
      "sha256": "1d04baf7142f2ab57681a13449afa67ec641b72527f33633d556c6ebf19790ab"
    },
    {
      "bytes": 11235,
      "path": "files/docs/benchmarks/simplified-likelihood-exporter-acceptance-2026-03-09.md",
      "sha256": "6cb1e4d157c7a49bad85b20f6f6108f703e0f00e78c5fa0d63b85755138fe8a3"
    },
    {
      "bytes": 12032,
      "path": "files/docs/benchmarks/simplified-likelihood-exporter-promotion-runbook-2026-03-09.md",
      "sha256": "7883f6017dc74fab913c92d85b35f8be21575ec3d11f2a29dc2490dde92aa671"
    },
    {
      "bytes": 8615,
      "path": "files/docs/benchmarks/simplified-likelihood-exporter-runtime-gate.md",
      "sha256": "44930820ef25db5a97a479e4ee87ccd2de41c1dcbb16a548ff3e0d61e80210e3"
    },
    {
      "bytes": 2338,
      "path": "files/docs/benchmarks/simplified-likelihood-exporter-stable-evidence-freshness-2026-03-09.md",
      "sha256": "a1eeb6381fcea503ab71ddc50ab3a934feeccad97e6ac24ec3ef4c46b367325c"
    },
    {
      "bytes": 5932,
      "path": "files/docs/benchmarks/simplified-likelihood-exporter-stable-evidence-policy-2026-03-09.md",
      "sha256": "2ad8a9f72e686ddca7679431e9e63b8c9ec43a2afc2a98de16bd11bee791dd98"
    },
    {
      "bytes": 3915,
      "path": "files/docs/benchmarks/simplified-likelihood-exporter-stable-source-semantics-boundary-2026-03-09.md",
      "sha256": "4b1b3821d6079ba7dc5fa780e1817e820188911fd14be389913bbf5204597b3e"
    },
    {
      "bytes": 9813,
      "path": "files/docs/benchmarks/simplified-likelihood-release-notes-2026-03-08.md",
      "sha256": "a981621feba5ab9220a13e4a3a9348832a1d69e9d0667c92292c8671ec6cecda"
    },
    {
      "bytes": 15062,
      "path": "files/docs/benchmarks/simplified-likelihood-support-matrix-2026-03-08.md",
      "sha256": "62dec48960ea538189f1adca7ec5b25cb126550b0941c0fd8dc0a2d230acfb4f"
    },
    {
      "bytes": 35601,
      "path": "files/docs/references/simplified-likelihood-artifacts.md",
      "sha256": "8f6be6f197fb49b578950f2c9ec3f2968dc042a0134ad6f685e34e5807b0bba8"
    },
    {
      "bytes": 3440,
      "path": "files/docs/schemas/apex2/simplified_likelihood_export_public_case_catalog_v0.schema.json",
      "sha256": "ba3c0fa241da992936a67711e36693d53865d24f2eb90fd0aba17828625fa72f"
    },
    {
      "bytes": 6220,
      "path": "files/docs/schemas/benchmarks/simplified_likelihood_export_benchmark_snapshot_report_v0.schema.json",
      "sha256": "7e25c3ec44298e4ce62c61c334a4f2c0d35e0b9c5b58d3be7e86af812856106b"
    },
    {
      "bytes": 7714,
      "path": "files/docs/schemas/benchmarks/simplified_likelihood_exporter_stable_evidence_freshness_report_v0.schema.json",
      "sha256": "b8356110bb001be6541d1755205503ec554a44bc32e1e136e2e657c4fa906185"
    },
    {
      "bytes": 7800,
      "path": "files/docs/schemas/benchmarks/simplified_likelihood_exporter_stable_evidence_policy_v0.schema.json",
      "sha256": "75f8a9743c93bb9fdd25cab4c9d16201afdecaeeae97049c6f8062e8cc8d38a9"
    },
    {
      "bytes": 5879,
      "path": "files/docs/schemas/benchmarks/simplified_likelihood_exporter_stable_source_semantics_boundary_v0.schema.json",
      "sha256": "3468209fe11a0b6da22d2888d5608b7449bd6bf497c13dc8d891437e3e92600f"
    },
    {
      "bytes": 4499,
      "path": "files/docs/schemas/hep/simplified_likelihood_derive_v0.schema.json",
      "sha256": "7132a1123fea0a1d40cbc0ce6376dd3bab3857e6f808639c580f540f05fd1c12"
    },
    {
      "bytes": 9150,
      "path": "files/docs/schemas/hep/simplified_likelihood_export_report_v0.schema.json",
      "sha256": "769eaf9e1d28016acfb2e31a3f1f7b1f508f596fc5739f1673aa6640cacb74ef"
    },
    {
      "bytes": 12508,
      "path": "files/docs/specs/apex2_simplified_likelihood_export_public_case_catalog_v0.example.json",
      "sha256": "4c4fd550eeb5a17111538644e06bc962e0999adeef73320f70c352cd4fadfa4d"
    },
    {
      "bytes": 2928,
      "path": "files/docs/specs/benchmarks/simplified_likelihood_export_benchmark_snapshot_report_v0.example.json",
      "sha256": "c577cb0f5e98f9edf6481cf6add1e6d7bdd206e93381cd83765acb1cc8824d5b"
    },
    {
      "bytes": 2824,
      "path": "files/docs/specs/benchmarks/simplified_likelihood_exporter_stable_evidence_freshness_report_v0.example.json",
      "sha256": "7a47751b6ce9c25a4e57e52390980d468b95b80701ff91e3d839588400da755d"
    },
    {
      "bytes": 4768,
      "path": "files/docs/specs/benchmarks/simplified_likelihood_exporter_stable_evidence_policy_v0.example.json",
      "sha256": "af9c77017075dac5dd1a669b92a79d3dab99595b6924bd3b3a84c68c8078f45e"
    },
    {
      "bytes": 4614,
      "path": "files/docs/specs/benchmarks/simplified_likelihood_exporter_stable_source_semantics_boundary_v0.example.json",
      "sha256": "294d8a6a08148eedf582ddd9a6f0c54c29869f4f428347fea016fb4b5ddedeaa"
    },
    {
      "bytes": 1227,
      "path": "files/docs/specs/hep/simplified_likelihood_derive_v0.example.json",
      "sha256": "48332272a9c09499be57c9144e41f7746c0d9fa7311883343b8f24a9f0717a6c"
    },
    {
      "bytes": 2212,
      "path": "files/docs/specs/hep/simplified_likelihood_derived_from_workspace_v0.example.json",
      "sha256": "be85f2305ab7d921cdefa169ad49ded6c41b9511d731eff0297606adfcf277f0"
    },
    {
      "bytes": 2755,
      "path": "files/docs/specs/hep/simplified_likelihood_export_report_v0.example.json",
      "sha256": "fe6535230cc7d6f901670da35db95ee733202aa4427dc4c629ecab01dc042c03"
    },
    {
      "bytes": 2405,
      "path": "promotion_bundle_promotion_report.json",
      "sha256": "924f6e44a02b2bc99210afa33543204fdd8322b8351a7055c867dbd4c7241c64"
    },
    {
      "bytes": 16103,
      "path": "promotion_evidence.json",
      "sha256": "8838366310a8b044075039f8af9f6d7c06d607f64a15d617eca8e351409f3023"
    },
    {
      "bytes": 2597,
      "path": "promotion_evidence_check.json",
      "sha256": "49a243da3b54823f91f959523c3e2fc282593757d819d308119267ac951b6bc7"
    },
    {
      "bytes": 13121,
      "path": "stable_candidate_blocker_matrix.json",
      "sha256": "c8b797c39bcffa9953be2945293410951c337fd1174493bbff424b570451e1d8"
    },
    {
      "bytes": 5774,
      "path": "stable_candidate_review_packet.json",
      "sha256": "3bd70fe95f19614d51997f17950f29a9b576f226de856e354d8854668bf24a2f"
    },
    {
      "bytes": 2710,
      "path": "stable_evidence_freshness_report.json",
      "sha256": "4d615187d9cc281ba79a0eda1e69f5b9e9485b388dd536cbcb96e56a0c33ee5a"
    },
    {
      "bytes": 4785,
      "path": "stable_evidence_policy.json",
      "sha256": "cdd4908d21c47c1ca8d63de1cb9cdef09c61bd12aa83d4b031f8cd10ba9eba38"
    },
    {
      "bytes": 9650,
      "path": "stable_promotion_decision.json",
      "sha256": "b32f2d41469db50d140a5deb31b08771f38a00a9daa2b42a75446eee82f69fe8"
    },
    {
      "bytes": 4822,
      "path": "stable_review_assessment.json",
      "sha256": "81d34ac00f990da64104dcc09c361de1a89dec413781fce06e046eaef7904448"
    },
    {
      "bytes": 4557,
      "path": "stable_source_semantics_boundary.json",
      "sha256": "27c70cb9393ece3a6baa4d433a630bc8dd89bfb58fcf4aea8ade5db8f7c388a1"
    }
  ],
  "generated_at": "2026-03-17T19:02:51.879603Z",
  "git": {
    "ref": "",
    "repository": "",
    "sha": ""
  },
  "schema_version": "nextstat.snapshot_index.v1",
  "snapshot_id": "exporter-20260317T000000Z-public-floor-nine-refresh4",
  "suite": "simplified_likelihood_exporter_promotion_bundle",
  "workflow": {}
}
